{
  "schema_version": "2.0",
  "status": "revise",
  "score_unrounded": 6.699999999999999,
  "threshold": 8.5,
  "dimensions": [
    {
      "key": "composition",
      "label": "构图与视觉平衡",
      "score": 6,
      "threshold": 8,
      "gap": 2,
      "pass": false,
      "evidence": "虚构演示：商品较小，画面大部分由不相关发光器械占据。",
      "confidence": 0.85
    },
    {
      "key": "hierarchy",
      "label": "视觉层级",
      "score": 6,
      "threshold": 8,
      "gap": 2,
      "pass": false,
      "evidence": "虚构演示：厚重标题和装饰先于商品/核心卖点被注意。",
      "confidence": 0.85
    },
    {
      "key": "color",
      "label": "配色与对比",
      "score": 8,
      "threshold": 8,
      "gap": 0,
      "pass": true,
      "evidence": "虚构演示：配色大方向协调，商品区域仍有明暗优化空间。",
      "confidence": 0.85
    },
    {
      "key": "typography",
      "label": "字体与排版",
      "score": 8,
      "threshold": 8,
      "gap": 0,
      "pass": true,
      "evidence": "虚构演示：卖点与价格的字级分组尚可，但整体网格需要重做。",
      "confidence": 0.85
    },
    {
      "key": "consistency",
      "label": "风格与场景适配",
      "score": 6,
      "threshold": 8,
      "gap": 2,
      "pass": false,
      "evidence": "虚构演示：场景标签偏日常使用，太空舱装饰没有足够依据。",
      "confidence": 0.85
    },
    {
      "key": "finish",
      "label": "自然质感与完成度",
      "score": 6,
      "threshold": 8,
      "gap": 2,
      "pass": false,
      "evidence": "虚构演示：不同材质呈相似塑料高光，悬浮道具缺少接触关系。",
      "confidence": 0.85
    }
  ],
  "below_threshold": [
    "composition",
    "hierarchy",
    "consistency",
    "finish"
  ],
  "config_snapshot": {
    "schema_version": "2.0",
    "rubric_version": "2.0",
    "score_scale": 10,
    "score_step": 0.5,
    "total_threshold": 8.5,
    "dimensions": {
      "composition": {
        "label": "构图与视觉平衡",
        "weight": 20,
        "threshold": 8
      },
      "hierarchy": {
        "label": "视觉层级",
        "weight": 20,
        "threshold": 8
      },
      "color": {
        "label": "配色与对比",
        "weight": 15,
        "threshold": 8
      },
      "typography": {
        "label": "字体与排版",
        "weight": 20,
        "threshold": 8
      },
      "consistency": {
        "label": "风格与场景适配",
        "weight": 15,
        "threshold": 8
      },
      "finish": {
        "label": "自然质感与完成度",
        "weight": 10,
        "threshold": 8
      }
    },
    "redesign": {
      "default": "auto",
      "structural_failure_count": 2,
      "naturalness_rebuild_below": 7,
      "preserve_layout": false
    },
    "loop": {
      "default_generation_rounds": 1,
      "max_generation_rounds": 3,
      "stagnation_rounds": 2,
      "min_total_gain": 0.2,
      "max_minutes": 15
    }
  },
  "design_plan": {
    "strategy": "redesign",
    "direction": "围绕商品及C组标签建立可信的商品广告；用原始素材做主角，不模仿旧科技促销模板",
    "product_presentation": "原商品图做主视觉，允许等比放大及重新定位，包装和标签不重绘",
    "layout": "重建商品区与独立信息区；核心卖点相邻分组，价格形成明确但不过度抢眼的行动节点",
    "typography": "采用适合商品气质的清晰字级与统一对齐；取消膨胀立体文字，保留输入原文",
    "palette": "从原商品与场景推导主色，控制辅助色和高亮，避免无理由霓虹",
    "background": "使用低干扰且支持场景标签的背景；有空间和支撑关系，不堆叠透明器械",
    "lighting": "采用一致方向的柔和主光和自然接触阴影，区分玻璃、金属及包装表面",
    "remove_elements": [
      "无功能发光底座",
      "无关器械",
      "多余悬浮珍珠",
      "膨胀立体文字"
    ],
    "preserve_additional": [],
    "strategy_reason": {
      "structural_failed_count": 3,
      "naturalness_failure": true,
      "model_proposal": "redesign"
    }
  },
  "generation_assets_ready": true,
  "overall_qualified": false
}
